tv-symbol;description;mic-code
PHGE.U;BiomX Inc. Units each consisting of one share of common stock and one Warrant entitling the holder to purchase one-half of a share of common stock;XASE
PHYD;Putnam ESG High Yield ETF;ARCX
PHYL;PGIM Active High Yield Bond ETF;ARCX
PHYS;Sprott Physical Gold Trust;ARCX
PICB;Invesco International Corporate Bond ETF;ARCX
PICK;iShares MSCI Global Metals & Mining Producers ETF;BATS
PIFI;ClearShares Piton Intermediate Fixed Income ETF;ARCX
PILL;Direxion Daily Pharmaceutical & Medical Bull 3X Shares;ARCX
PIN;Invesco India ETF;ARCX
PINK;Simplify Health Care ETF;ARCX
PIT;VanEck Commodity Strategy ETF;BATS
PJAN;Innovator U.S. Equity Power Buffer ETF - January;BATS
PJBF;PGIM Jennison Better Future ETF;BATS
PJFG;PGIM Jennison Focused Growth ETF;ARCX
PJFM;PGIM Jennison Focused Mid-Cap ETF;BATS
PJFV;PGIM Jennison Focused Value ETF;ARCX
PJIO;PGIM Jennison International Opportunities ETF;ARCX
PJP;Invesco Pharmaceuticals ETF;ARCX
PJUL;Innovator U.S. Equity Power Buffer ETF - July;BATS
PJUN;Innovator U.S. Equity Power Buffer ETF - June;BATS
PKB;Invesco Building & Construction ETF;ARCX
PLAG;Planet Green Holdings Corp.;XASE
PLDR;Putnam Sustainable Leaders ETF;ARCX
PLG;Platinum Group Metals LTD.;XASE
PLTM;GraniteShares Platinum Shares;ARCX
PLX;Protalix BioTherapeutics Inc. Common Stock;XASE
PMAR;Innovator U.S. Equity Power Buffer ETF - March;BATS
PMAY;Innovator U.S. Equity Power Buffer ETF - May;BATS
PNOV;Innovator U.S. Equity Power Buffer ETF - November;BATS
POCT;Innovator U.S. Equity Power Buffer ETF - October;BATS
POL;Polished.com Inc.;XASE
POWA;Invesco Bloomberg Pricing Power ETF;ARCX
PP;The Meet Kevin Pricing Power ETF;ARCX
PPA;Invesco Aerospace & Defense ETF;ARCX
PPEM;Putnam PanAgora ESG Emerging Markets Equity ETF;ARCX
PPI;AXS Astoria Inflation Sensitive ETF;ARCX
PPIE;Putnam PanAgora ESG International Equity ETF;ARCX
PPLT;abrdn Physical Platinum Shares ETF;ARCX
PPTY;U.S. Diversified Real Estate ETF;ARCX
PQDI;Principal Spectrum Tax-Advantaged Dividend Active ETF;ARCX
PRAE;PlanRock Alternative Growth ETF;ARCX
PRAY;FIS Christian Stock Fund;ARCX
PREF;Principal Spectrum Preferred Securities Active ETF;ARCX
PRF;Invesco FTSE RAFI US 1000 ETF;ARCX
PRFD;PIMCO Preferred and Capital Securities Active Exchange-Traded Fund;ARCX
PRK;Park National Corporation;XASE
PRMN;PlanRock Market Neutral Income ETF;ARCX
PRNT;The 3D Printing ETF;BATS
PSCJ;Pacer Swan SOS Conservative (July) ETF;BATS
PSCQ;Pacer Swan SOS Conservative (October) ETF;BATS
PSCW;Pacer Swan SOS Conservative (April) ETF;BATS
PSCX;Pacer Swan SOS Conservative (January) ETF;BATS
PSDM;PGIM Short Duration Multi-Sector Bond ETF;BATS
PSEP;Innovator U.S. Equity Power Buffer ETF - September;BATS
PSFD;Pacer Swan SOS Flex (January) ETF;BATS
PSFF;Pacer Swan SOS Fund of Funds ETF;BATS
PSFJ;Pacer Swan SOS Flex (July) ETF;BATS
PSFM;Pacer Swan SOS Flex (April) ETF;BATS
PSFO;Pacer Swan SOS Flex (October) ETF;BATS
PSH;PGIM Short Duration High Yield ETF;BATS
PSI;Invesco Semiconductors ETF;ARCX
PSIL;AdvisorShares Psychedelics ETF;ARCX
PSK;SPDR ICE Preferred Securities ETF;ARCX
PSLV;Sprott Physical Silver Trust;ARCX
PSMD;Pacer Swan SOS Moderate (January) ETF;BATS
PSMJ;Pacer Swan SOS Moderate (July) ETF;BATS
PSMO;Pacer Swan SOS Moderate (October) ETF;BATS
PSMR;Pacer Swan SOS Moderate (April) ETF;BATS
PSP;Invesco Global Listed Private Equity ETF;ARCX
PSQ;ProShares Short QQQ;ARCX
PSR;Invesco Active U.S. Real Estate Fund;ARCX
PST;ProShares Trust UltraShort Lehman 7-10 Year Treasury;ARCX
PSTP;Innovator Power Buffer Step-Up Strategy ETF;ARCX
PTBD;Pacer Trendpilot US Bond ETF;ARCX
PTEST;ARCA Test Symbol;ARCX
PTEST.A;NYSE Arca Test Symbol;ARCX
PTEST.B;NYSE Arca Test Symbol;ARCX
PTEST.W;Test Symbol Class W;ARCX
PTEST.X;Test Symbol Class X;ARCX
PTEST.Y;Test Symbol Class Y;ARCX
PTEST.Z;NYSE Arca TEST SYMBOL SIFMA / DTCC Eligible;ARCX
PTEU;Pacer TrendpilotTM European Index ETF;BATS
PTIN;Pacer Trendpilot International ETF;ARCX
PTLC;Pacer Trendpilot US Large Cap ETF;BATS
PTMC;Pacer Trendpilot US Mid Cap ETF;BATS
PTN;Palatin Technologies Inc.;XASE
PTRB;PGIM Total Return Bond ETF;ARCX
PULS;PGIM Ultra Short Bond ETF;ARCX
PULT;Putnam ESG Ultra Short ETF;ARCX
PUTD;Cboe Validus S&P 500 Dynamic PutWrite Index ETF;BATS
PUTW;WisdomTree PutWrite Strategy Fund;ARCX
PVAL;Putnam Focused Large Cap Value ETF;ARCX
PVI;Invesco Floating Rate Municipal Income ETF;ARCX
PW;Power REIT;XASE
PW/PA;Power REIT  7.75% Series A Cumulative Redeemable Perpetual Preferred Stock Liquidation Preference $25.00 per Share;XASE
PWB;Invesco Large Cap Growth ETF;ARCX
PWER;Macquarie Energy Transition ETF;ARCX
PWS;Pacer WealthShield ETF;BATS
PWV;Invesco Large Cap Value ETF;ARCX
PWZ;Invesco California AMT-Free Municipal Bond ETF;ARCX
PXE;Invesco Energy Exploration & Production ETF;ARCX
PXF;Invesco FTSE RAFI Developed Markets ex-U.S. ETF;ARCX
PXH;Invesco FTSE RAFI Emerging Markets ETF;ARCX
PXJ;Invesco Oil & Gas Services ETF;ARCX
PYLD;PIMCO Multi Sector Bond Active ETF;ARCX
PYPY;YieldMax PYPL Option Income Strategy ETF;ARCX
PZA;Invesco National AMT-Free Municipal Bond ETF;ARCX
PZG;Paramount Gold Nevada Corp.;XASE
PZT;Invesco New York AMT-Free Municipal Bond ETF;ARCX
QAI;IQ Hedge Multi-Strategy Tracker ETF;ARCX
QARP;Xtrackers Russell 1000 US Quality at a Reasonable Price ETF;ARCX
QCON;American Century Quality Convertible Securities ETF;BATS
QDEC;FT Vest Growth-100 Buffer ETF - December;BATS
QDEF;FlexShares Quality Dividend Defensive Index Fund;ARCX
QDF;FlexShares Quality Dividend Index Fund;ARCX
QDIV;Global X S&P 500 Quality Dividend ETF;ARCX
QDPL;Pacer Metaurus US Large Cap Dividend Multiplier 400 ETF;ARCX
QEFA;SPDR MSCI EAFE StrategicFactors ETF;ARCX
QEMM;SPDR MSCI Emerging Markets StrategicFactors ETF;ARCX
QFLR;Innovator Nasdaq-100 Managed Floor ETF;ARCX
QFTA;Quantum FinTech Acquisition Corporation;XASE
QGRO;American Century U.S. Quality Growth ETF;ARCX
QGRW;WisdomTree U.S. Quality Growth Fund;ARCX
QID;ProShares UltraShort QQQ;ARCX
QINT;American Century Quality Diversified International ETF;ARCX
QIS;Simplify Multi-QIS Alternative ETF;ARCX
QJUN;FT Vest Growth-100 Buffer ETF - June;BATS
QLC;FlexShares US Quality Large Cap Index Fund;BATS
QLD;ProShares Ultra QQQ;ARCX
QLTA;iShares Aaa - A Rated Corporate Bond ETF;ARCX
QLTY;GMO U.S. Quality ETF;ARCX
QLV;FlexShares US Quality Low Volatility Index Fund;ARCX
QLVD;FlexShares Developed Markets ex-US Quality Low Volatility Index Fund;ARCX
QLVE;FlexShares Emerging Markets Quality Low Volatility Index Fund;ARCX
QMAR;FT Vest Growth-100 Buffer ETF - March;BATS
QPFF;American Century Quality Preferred ETF;BATS
QPX;AdvisorShares Q Dynamic Growth ETF;ARCX
QQH;HCM Defender 100 Index ETF;ARCX
QRFT;Qraft AI-Enhanced US Large Cap ETF;ARCX
QSPT;FT Vest Nasdaq-100 Buffer ETF - September;BATS
QSWN;Amplify BlackSwan Tech & Treasury ETF;ARCX
QTAP;Innovator Growth Accelerated Plus ETF - April;BATS
QTJA;Innovator Growth Accelerated Plus ETF - January;BATS
QTJL;Innovator Growth Accelerated Plus ETF - July;BATS
QTOC;Innovator Growth Accelerated Plus ETF - October;BATS
QTUM;Defiance Quantum ETF;ARCX
QUAL;iShares MSCI USA Quality Factor ETF;BATS
QULL;ETRACS 2x Leveraged MSCI US Quality Factor TR ETN;ARCX
QUS;SPDR MSCI USA StrategicFactors ETF;ARCX
QUVU;Hartford Quality Value ETF;BATS
QVML;Invesco S&P 500 QVM Multi-factor ETF;ARCX
QVMM;Invesco S&P MidCap 400 QVM Multi-factor ETF;ARCX
QVMS;Invesco S&P SmallCap 600 QVM Multi-factor ETF;ARCX
QVOY;Q3 All-Season Active Rotation ETF;BATS
QWLD;SPDR MSCI World StrategicFactors ETF;ARCX
RAAX;VanEck Inflation Allocation ETF;ARCX
RAFE;PIMCO RAFI ESG U.S. ETF;ARCX
RATE;Global X Interest Rate Hedge ETF;ARCX
RAVI;FlexShares Ultra-Short Income Fund;ARCX
RAYC;Rayliant Quantamental China Equity ETF;ARCX
RAYD;Rayliant Quantitative Developed Market Equity ETF;ARCX
RAYE;Rayliant Quantamental Emerging Market ex-China Equity ETF;ARCX
RBLD;First Trust Alerian US NextGen Infrastructure ETF;ARCX
RCG;RENN Fund Inc.;XASE
RDFI;Rareview Dynamic Fixed Income ETF;BATS
RDIV;Invesco S&P Ultra Dividend Revenue ETF;ARCX
RDOG;ALPS REIT Dividend Dogs ETF;ARCX
RDVI;FT Vest Rising Dividend Achievers Target Income ETF;BATS
RECS;Columbia Research Enhanced Core ETF;ARCX
REET;iShares Global REIT ETF;ARCX
REGL;ProShares S&P MidCap 400 Dividend Aristocrats ETF;BATS
REI;Ring Energy Inc.;XASE
REK;ProShares Short Real Estate;ARCX
REM;iShares Mortgage Real Estate ETF;BATS
REMX;VanEck Rare Earth/Strategic Metals ETF;ARCX
RENW;Harbor Energy Transition Strategy ETF;ARCX
REPX;Riley Exploration Permian Inc.;XASE
RESD;WisdomTree International ESG Fund;BATS
RESE;WisdomTree Emerging Markets ESG Fund;BATS
RESP;WisdomTree U.S. ESG Fund;ARCX
RETL;Direxion Daily Retail Bull 3X Shares;ARCX
REVS;Columbia Research Enhanced Value ETF;ARCX
REW;Proshares UltraShort Technology;ARCX
REZ;iShares Residential and Multisector Real Estate ETF;ARCX
RFCI;RiverFront Dynamic Core Income;ARCX
RFDA;RiverFront Dynamic US Dividend Advantage ETF;ARCX
RFFC;ALPS Active Equity Opportunity ETF;ARCX
RFG;Invesco S&P MidCap 400 Pure Growth ETF;ARCX
RFV;Invesco S&P MidCap 400 Pure Value ETF;ARCX
RHCB;BNY Mellon Responsible Horizons Corporate Bond ETF;ARCX
RHE;Regional Health Properties Inc.;XASE
RHE/PA;Regional Health Properties Inc. Regional Health Properties Inc. 10.875 percent Series A Cumulative Redeemable Preferred Stock;XASE
RHRX;RH Tactical Rotation ETF;ARCX
RHTX;RH Tactical Outlook ETF;ARCX
RIET;Hoya Capital High Dividend Yield ETF;ARCX
RIGS;RiverFront Strategic Income Fund;ARCX
RINC;AXS Real Estate Income ETF;ARCX
RINF;ProShares Inflation Expectations ETF;ARCX
RISN;Inspire Tactical Balanced ETF;ARCX
RISR;FolioBeyond Alternative Income and Interest Rate Hedge ETF;ARCX
RITA;ETFB Green SRI REITs ETF;ARCX
RJMG;FT Raymond James Multicap Growth Equity ETF;ARCX
RLGT;Radiant Logistics Inc.;XASE
RLY;SPDR SSgA Multi-Asset Real Return ETF of SSgA Active Trust;ARCX
RMIF;LHA Risk-Managed Income ETF;BATS
RNWZ;TrueShares Eagle Global Renewable Energy Income ETF;ARCX
ROAM;Hartford Multifactor Emerging Markets ETF;ARCX
ROBO;ROBO Global Robotics & Automation Index ETF;ARCX
RODE;Hartford Multifactor Diversified International ETF;BATS
RODM;Hartford Multifactor Developed Markets (ex-US) ETF;ARCX
ROKT;SPDR S&P Kensho Final Frontiers ETF;ARCX
ROM;ProShares Ultra Technology;ARCX
ROMO;Strategy Shares Newfound/ReSolve Robust Momentum ETF;BATS
ROOF;IQ CBRE NextGen Real Estate ETF;ARCX
RORO;ATAC US Rotation ETF;ARCX
ROSC;Hartford Multifactor Small Cap ETF;ARCX
ROUS;Hartford Multifactor US Equity ETF;ARCX
ROYA;Tema Global Royalties ETF;BATS
RPAR;RPAR Risk Parity ETF;ARCX
RPG;Invesco S&P 500 Pure Growth ETF;ARCX
RPHS;Regents Park Hedged Market Strategy ETF;BATS
RPV;Invesco S&P 500 Pure Value ETF;ARCX
RSBT;Return Stacked Bonds & Managed Futures ETF;BATS
RSEE;Rareview Systematic Equity ETF;BATS
RSHO;Tema American Reshoring ETF;ARCX
RSP;Invesco S&P 500 Equal Weight ETF;ARCX
RSPC;Invesco Exchange-Traded Fund Trust Invesco S&P 500 Equal Weight Communication Services ETF;ARCX
RSPD;Invesco S&P 500 Equal Weight Consumer Discretionary ETF;ARCX
RSPE;Invesco ESG S&P 500 Equal Weight ETF;ARCX
RSPF;Invesco S&P 500 Equal Weight Financials ETF;ARCX
RSPG;Invesco S&P 500 Equal Weight Energy ETF;ARCX
RSPH;Invesco S&P 500 Equal Weight Health Care ETF;ARCX
RSPM;Invesco S&P 500 Equal Weight Materials ETF;ARCX
RSPN;Invesco S&P 500 Equal Weight Industrials ETF;ARCX
RSPR;Invesco S&P 500 Equal Weight Real Estate ETF;ARCX
RSPS;Invesco S&P 500 Equal Weight Consumer Staples ETF;ARCX
RSPT;Invesco S&P 500 Equal Weight Technology ETF;ARCX
RSPU;Invesco S&P 500 Equal Weight Utilities ETF;ARCX
RSSB;Return Stacked Global Stocks & Bonds ETF;BATS
RSST;Return Stacked U.S. Stocks & Managed Futures ETF;BATS
RTAI;Rareview Tax Advantaged Income ETF;BATS
RUFF;Alpha Dog ETF;ARCX
RULE;Adaptive Core ETF;BATS
RVNU;Xtrackers Municipal Infrastructure Revenue Bond ETF;ARCX
RVP;Retractable Technologies Inc;XASE
RVRB;Reverb ETF;BATS
RWJ;Invesco S&P SmallCap 600 Revenue ETF;ARCX
RWK;Invesco S&P MidCap 400 Revenue ETF;ARCX
RWL;Invesco S&P 500 Revenue ETF;ARCX
RWM;ProShares Short Russell2000;ARCX
RWO;SPDR  Dow Jones  Global Real Estate ETF;ARCX
RWR;SPDR Dow Jones REIT ETF;ARCX
RWX;SPDR Dow Jones  International Real Estate ETF;ARCX
RXD;ProShares UltraShort Health Care;ARCX
RXI;iShares Global Consumer Discretionary ETF;ARCX
RXL;ProShares Ultra Health Care;ARCX
RYJ;Invesco Raymond James SB-1 Equity ETF;ARCX
RYLD;Global X Russell 2000 Covered Call ETF;ARCX
RYLG;Global X Russell 2000 Covered Call & Growth ETF;ARCX
RYSE;Vest 10 Year Interest Rate Hedge ETF;BATS
RZG;Invesco S&P SmallCap 600 Pure Growth ETF;ARCX
RZV;Invesco S&P SmallCap 600 Pure Value ETF;ARCX
SAA;ProShares Ulta SmallCap600;ARCX
SACC;Sachem Capital Corp. 6.875% Notes due 2024;XASE
SACH;Sachem Capital Corp. Common Shares;XASE
SACH/PA;Sachem Capital Corp. 7.75% Series A Cumulative Redeemable Preferred Stock;XASE
SAEF;Schwab Ariel ESG ETF;ARCX
SAGP;Strategas Global Policy Opportunities ETF;ARCX
SAMT;Strategas Macro Thematic Opportunities ETF;ARCX
SANE;Subversive Mental Health ETF;BATS
SATO;Invesco Alerian Galaxy Crypto Economy ETF;BATS
SATX;SatixFy Communications Ltd.;XASE
SAUG;FT Vest U.S. Small Cap Moderate Buffer ETF - August;BATS
SBB;ProShares Short SmallCap600;ARCX
SBEV;Splash Beverage Group Inc.;XASE
SBEV/W;Splash Beverage Group Inc. Warrants to purchase one whole share of Common Stock at an exercise price of $4.60;XASE
SBIO;ALPS Medical Breakthroughs ETF;ARCX
SBND;Columbia Short Duration Bond ETF;ARCX
SCAP;InfraCap Small Cap Income ETF;ARCX
SCC;ProShares UltraShort Consumer Discretionary;ARCX
SCCB;Sachem Capital Corp. 7.125% Notes due 2024;XASE
SCCC;Sachem Capital Corp. 7.75% Notes due 2025;XASE
SCCD;Sachem Capital Corp. 6.00% Notes due 2026;XASE
SCCE;Sachem Capital Corp. 6.00% Notes due 2027;XASE
SCCF;Sachem Capital Corp. 7.125% Notes due 2027;XASE
SCCG;Sachem Capital Corp. 8.00% Notes due 2027;XASE
SCDL;ETRACS 2x Leveraged US Dividend Factor TR ETN;ARCX
SCHA;Schwab U.S Small- Cap ETF;ARCX
SCHB;Schwab U.S. Broad Market ETF;ARCX
SCHC;Schwab International Small-Cap Equity ETF;ARCX
SCHD;Schwab US Dividend Equity ETF;ARCX
SCHE;Schwab Emerging Markets Equity ETF;ARCX
SCHF;Schwab International Equity ETF;ARCX
SCHG;Schwab U.S. Large-Cap Growth ETF;ARCX
SCHH;Schwab U.S. REIT ETF;ARCX
SCHI;Schwab 5-10 Year Corporate Bond ETF;ARCX
SCHJ;Schwab 1-5 Year Corporate Bond ETF;ARCX
SCHK;Schwab 1000 Index ETF;ARCX
SCHM;Schwab U.S. Mid-Cap ETF;ARCX
SCHO;Schwab Short-Term U.S. Treasury ETF;ARCX
SCHP;Schwab U.S. TIPS ETF;ARCX
SCHQ;Schwab Long-Term U.S. Treasury ETF;ARCX
SCHR;Schwab Intermediately-Term U.S. Treasury ETF;ARCX
SCHV;Schwab U.S. Large-Cap Value ETF;ARCX
SCHX;Schwab U.S. Large- Cap ETF;ARCX
SCHY;Schwab International Dividend Equity ETF;ARCX
SCHZ;Schwab US Aggregate Bond ETF;ARCX
SCJ;iShares MSCI Japan Small-Cap ETF;ARCX
SCMB;Schwab Municipal Bond ETF;ARCX
SCO;ProShares UltraShort Bloomberg Crude Oil;ARCX
SCRD;Janus Henderson Sustainable Corporate Bond ETF;ARCX
SCYB;Schwab High Yield Bond ETF;ARCX
SDCI;USCF SummerHaven Dynamic Commodity Strategy No K-1 Fund;ARCX
SDCP;Virtus Newfleet Short Duration Core Plus Bond ETF;ARCX
SDD;ProShares UltraShort SmallCap600;ARCX
SDEM;Global X MSCI SuperDividend Emerging Markets ETF;ARCX
SDIV;Global X SuperDividend ETF;ARCX
SDOG;ALPS Sector Dividend Dogs ETF;ARCX
SDOW;ProShares UltraPro Short Dow 30;ARCX
SDP;ProShares UltraShort Utilities;ARCX
SDPI;Superior Drilling Products Inc.;XASE
SDS;ProShares UltraShort S&P500;ARCX
SDVD;FT Vest SMID Rising Dividend Achievers Target Income ETF;BATS
SDY;SPDR S&P Dividend ETF;ARCX
SEA;U.S. Global Sea to Sky Cargo ETF;ARCX
SEB;Seaboard Corporation;XASE
SECT;Main Sector Rotation ETF;BATS
SEF;ProShares Short Financials;ARCX
SEIM;SEI Enhanced U.S. Large Cap Momentum Factor ETF;BATS
SEIQ;SEI Enhanced U.S. Large Cap Quality Factor ETF;BATS
SEIV;SEI Enhanced U.S. Large Cap Value Factor ETF;BATS
SEIX;Virtus SEIX Senior Loan ETF;ARCX
SELV;SEI Enhanced Low Volatility U.S. Large Cap ETF;BATS
SEMI;Columbia Seligman Semiconductor and Technology ETF;ARCX
SENS;Senseonics Holdings Inc.;XASE
SEPT;AllianzIM U.S. Large Cap Buffer10 Sep ETF;ARCX
SEPW;AllianzIM U.S. Large Cap Buffer20 Sep ETF;ARCX
SEPZ;TrueShares Structured Outcome (September) ETF;BATS
SETH;ProShares Short Ether Strategy ETF;ARCX
SFIG;WisdomTree U.S. Short Term Corporate Bond Fund;BATS
SFLR;Innovator Equity Managed Floor ETF;ARCX
SFY;SoFi Select 500 ETF;ARCX
SFYF;SoFi Social 50 ETF;ARCX
SFYX;SoFi Next 500 ETF;ARCX
SGDJ;Sprott Junior Gold Miners ETF;ARCX
SGDM;Sprott Gold Miners ETF;ARCX
SGE;Strong Global Entertainment Inc.;XASE
SGLC;SGI U.S. Large Cap Core ETF;ARCX
SGN;Signing Day Sports Inc.;XASE
SGOL;abrdn Physical Gold Shares ETF;ARCX
SGOV;iShares 0-3 Month Treasury Bond ETF;ARCX
SH;ProShares Short S&P500;ARCX
SHAG;WisdomTree Yield Enhanced U.S. Short-Term Aggregate Bond Fund;BATS
SHDG;Soundwatch Hedged Equity ETF;BATS
SHE;SPDR MSCI USA Gender Diversity ETF;ARCX
SHLD;Global X Defense Tech ETF;ARCX
SHM;SPDR Nuveen Bloomberg Short Term Municipal Bond ETF;ARCX
SHNY;MicroSectors Gold 3x Leveraged ETN;ARCX
SHPP;Pacer Industrials and Logistics ETF;ARCX
SHRT;Gotham Short Strategies ETF;ARCX
SHUS;Syntax Stratified U.S. Total Market Hedged ETF;ARCX
SHYD;VanEck Short High Yield Muni ETF;BATS
SHYG;iShares 0-5 Year High Yield Corporate Bond ETF;ARCX
SHYL;Xtrackers Short Duration High Yield Bond ETF;ARCX
SIF;SIFCO Industries Inc.;XASE
SIFI;Harbor Scientific Alpha Income ETF;ARCX
SIHY;Harbor Scientific Alpha High-Yield ETF;ARCX
SIJ;ProShares UltraShort Industrials;ARCX
SIL;Global X Silver Miners ETF (NEW);ARCX
SILJ;ETFMG Prime Junior Silver Miners ETF;ARCX
SILV;SilverCrest Metals Inc. Common Shares;XASE
SIM;Groupo Simec S.A.B de C.V.;XASE
SIMS;SPDR S&P Kensho Intelligent Structures ETF;ARCX
SING;SinglePoint Inc.;BATS
SIO;Touchstone Strategic Income Opportunities ETF;ARCX
SIVR;abrdn Physical Silver Shares ETF;ARCX
SIXA;ETC 6 Meridian Mega Cap Equity ETF;ARCX
SIXH;ETC 6 Meridian Hedged Equity Index Option ETF;ARCX
SIXJ;AllianzIM U.S. Large Cap 6 Month Buffer10 Jan/Jul ETF;ARCX
SIXL;ETC 6 Meridian Low Beta Equity ETF;ARCX
SIXO;AllianzIM U.S. Large Cap 6 Month Buffer10 Apr/Oct ETF;ARCX
SIXS;ETC 6 Meridian Small Cap Equity ETF;ARCX
SIZE;iShares MSCI USA Size Factor ETF;ARCX
SJB;ProShares Short High Yield;ARCX
SJIM;Inverse Cramer Tracker ETF;BATS
SJNK;SPDR Bloomberg Short Term High Yield Bond ETF;ARCX
SKF;ProShares UltraShort Financials;ARCX
SKYH;Sky Harbour Group Corporation;XASE
SKYH/W;Sky Harbour Group Corporation Warrants each whole warrant exercisable for one share of Class A common stock at an exercise price of $11.50 per share;XASE
SLI;Standard Lithium Ltd.;XASE
SLND;Southland Holdings Inc.;XASE
SLND/W;Southland Holdings Inc. Redeemable Warrants each whole warrant exercisable for shares of common stock at an exercise price of $11.50 per share;XASE
SLV;iShares Silver Trust;ARCX
SLVP;iShares MSCI Global Silver and Metals Miners ETF;BATS
SLX;VanEck Steel ETF;ARCX
SLYG;SPDR S&P 600 Small Cap Growth ETF (based on S&P SmallCap 600 Growth Index--symbol: CKG);ARCX
SLYV;SPDR S&P 600 Small Cap Value ETF (based on S&P SmallCap 600 Value Index symbol--CVK);ARCX
SMAY;FT Vest U.S. Small Cap Moderate Buffer ETF - May;BATS
SMB;VanEck Short Muni ETF;BATS
SMDD;ProShares UltraPro Short MidCap400;ARCX
SMDV;ProShares Russell 2000 Dividend Growers ETF;BATS
SMDY;Syntax Stratified MidCap ETF;ARCX
SMHB;ETRACS 2xMonthly Pay Leveraged US Small Cap High Dividend ETN Series B;ARCX
SMI;VanEck HIP Sustainable Muni ETF;BATS
SMIG;AAM Bahl & Gaynor Small/Mid Cap Income Growth ETF;ARCX
SMIN;iShares MSCI India Small-Cap ETF;BATS
SMIZ;Zacks Small/Mid Cap ETF;ARCX
SMLE;Xtrackers S&P SmallCap 600 ESG ETF;ARCX
SMLF;iShares U.S. Small Cap Equity Factor ETF;ARCX
SMLV;SPDR SSGA US Small Cap Low Volatility Index ETF;ARCX
SMMD;iShares Russell 2500 ETF;BATS
SMMU;PIMCO Short Term Municipal Bond Active Exchange-Traded Fund;ARCX
SMMV;iShares MSCI USA Small-Cap Min Vol Factor ETF;BATS
SMN;ProShares UltraShort Materials;ARCX
SMOG;VanEck Low Carbon Energy ETF;ARCX
SMOT;VanEck Morningstar SMID Moat ETF;BATS
SMTH;ALPS Smith Core Plus Bond ETF;ARCX
SNAV;Mohr Sector Nav ETF;BATS
SNMP;Evolve Transition Infrastructure LP;XASE
SNOV;FT Vest U.S. Small Cap Moderate Buffer ETF - November;BATS
SNPD;Xtrackers S&P ESG Dividend Aristocrats ETF;BATS
SNPE;Xtrackers S&P 500 ESG ETF;ARCX
SNPG;Xtrackers S&P 500 Growth ESG ETF;BATS
SNPV;Xtrackers S&P 500 Value ESG ETF;BATS
SOAR;Volato Group Inc.;XASE
SOAR/W;Volato Group Inc. Redeemable Warrants each whole warrant exercisable for one share of Class A common stock at an exercise price of $11.50;XASE
SOF;Amplify Samsung SOFR ETF;ARCX
SOLR;SmartETFs Sustainable Energy II ETF;ARCX
SOVF;Sovereign's Capital Flourish Fund;ARCX
SOXL;Direxion Daily Semiconductor Bull 3X Shares;ARCX
SOXS;Direxion Daily Semiconductor Bear 3X Shares;ARCX
SOYB;Teucrium Soybean Fund;ARCX
SPAB;SPDR Portfolio Aggregate Bond ETF;ARCX
SPAX;Robinson Alternative Yield Pre-merger SPAC ETF;ARCX
SPBO;SPDR Portfolio Corporate Bond ETF;ARCX
SPCZ;RiverNorth Enhanced Pre-Merger SPAC ETF;BATS
SPD;Simplify US Equity PLUS Downside Convexity ETF;ARCX
SPDG;SPDR Portfolio S&P Sector Neutral Dividend ETF;ARCX
SPDN;Direxion Daily S&P 500 Bear 1X Shares;ARCX
SPDV;AAM S&P 500 High Dividend Value ETF;ARCX
SPDW;SPDR Portfolio Developed World ex-US ETF;ARCX
SPEM;SPDR Portfolio Emerging Markets ETF;ARCX
SPEU;SPDR Portfolio Europe ETF;ARCX
SPFF;Global X SuperIncome Preferred ETF;ARCX
SPGM;SPDR Portfolio MSCI Global Stock Market ETF;ARCX
SPGP;Invesco S&P 500 GARP ETF;ARCX
SPHB;Invesco S&P 500 High Beta ETF;ARCX
SPHD;Invesco S&P 500 High Dividend Low Volatility ETF;ARCX
SPHQ;Invesco S&P 500 Quality ETF;ARCX
SPHY;SPDR Portfolio High Yield Bond ETF;ARCX
SPIB;SPDR Portfolio Intermediate Term Corporate Bond ETF;ARCX
SPIP;SPDR Portfolio TIPS ETF;ARCX
SPLB;SPDR Portfolio Long Term Corporate Bond ETF;ARCX
SPLG;SPDR Portfolio S&P 500 ETF;ARCX
SPLV;Invesco S&P 500 Low Volatility ETF;ARCX
SPMB;SPDR Portfolio Mortgage Backed Bond ETF;ARCX
SPMD;SPDR Portfolio S&P 400 Mid Cap ETF;ARCX
SPMO;Invesco S&P 500 Momentum ETF;ARCX
SPMV;Invesco S&P 500 Minimum Variance ETF;BATS
SPPP;Sprott Physical Platinum and Palladium Trust;ARCX
SPQ;Simplify US Equity PLUS QIS ETF;ARCX
SPRE;SP Funds S&P Global REIT Sharia ETF;ARCX
SPSB;SPDR Portfolio Short Term Corporate Bond ETF;ARCX
SPSK;SP Funds Dow Jones Global Sukuk ETF;ARCX
SPSM;SPDR Portfolio S&P 600 Small Cap ETF;ARCX
SPTE;SP Funds S&P Global Technology ETF;ARCX
SPTI;SPDR Portfolio Intermediate Term Treasury ETF;ARCX
SPTL;SPDR Portfolio Long Term Treasury ETF;ARCX
SPTM;SPDR Portfolio S&P 1500 Composite Stock Market ETF;ARCX
SPTS;SPDR Portfolio Short Term Treasury ETF;ARCX
SPUC;Simplify US Equity PLUS Upside Convexity ETF;ARCX
SPUS;SP Funds S&P 500 Sharia  ETF;ARCX
SPUU;Direxion Daily S&P 500 Bull 2X Shares;ARCX
SPVM;Invesco S&P 500 Value with Momentum ETF;ARCX
SPVU;Invesco S&P 500 Enhanced Value ETF;ARCX
SPWO;SP Funds S&P World (ex-US) ETF;ARCX
SPXB;ProShares S&P 500 Bond ETF;ARCX
SPXE;ProShares S&P 500 Ex-Energy ETF;ARCX
SPXL;Direxion Daily S&P 500  Bull 3x Shares;ARCX
SPXN;ProShares S&P 500 Ex-Financials ETF;ARCX
SPXS;Direxion Daily S&P 500 Bear 3x Shares;ARCX
SPXT;ProShares S&P 500 Ex-Technology ETF;ARCX
SPXU;ProShares UltraPro Short S&P 500;ARCX
SPXV;ProShares S&P 500 Ex-Health Care ETF;ARCX
SPY;SPDR S&P 500 ETF Trust;ARCX
SPYC;Simplify US Equity PLUS Convexity ETF;ARCX
SPYD;SPDR Portfolio S&P 500 High Dividend ETF;ARCX
SPYG;SPDR Portfolio S&P 500 Growth ETF;ARCX
SPYI;NEOS S&P 500 High Income ETF;BATS
SPYV;SPDR Portfolio S&P 500 Value ETF;ARCX
SPYX;SPDR S&P 500 Fossil Fuel Free ETF;ARCX
SQEW;LeaderShares Equity Skew ETF;ARCX
SQY;YieldMax SQ Option Income Strategy ETF;ARCX
SRHQ;SRH U.S. Quality ETF;ARCX
SRHR;SRH REIT Covered Call ETF;ARCX
SRLN;SPDR Blackstone Senior Loan ETF;ARCX
SROI;Calamos Antetokounmpo Global Sustainable Equities ETF;ARCX
SRS;ProShares UltraShort Real Estate;ARCX
SRTY;ProShares UltraPro Short Russell2000;ARCX
SRVR;Pacer Data & Infrastructure Real Estate ETF;ARCX
SSFI;Day Hagan/Ned Davis Research Smart Sector Fixed Income ETF;ARCX
SSG;ProShares UltraShort Semiconductors;ARCX
SSLY;Syntax Stratified SmallCap ETF;ARCX
SSO;ProShares Ultra S&P500;ARCX
SSPX;Janus Henderson US Sustainable EquityETF;ARCX
SSPY;Syntax Stratified LargeCap ETF;ARCX
SSUS;Day Hagan Ned Davis Research Smart Sector ETF;ARCX
SSXU;Day Hagan/Ned Davis Research Smart Sector International ETF;ARCX
SSY;SunLink Health Systems Inc;XASE
STAX;Macquarie Tax-Free USA Short Term ETF;ARCX
STCE;Schwab Crypto Thematic ETF;ARCX
STIP;iShares 0-5 Year TIPS Bond ETF;ARCX
STLG;iShares Factors US Growth Style ETF;BATS
STNC;Hennessy Stance ESG ETF;ARCX
STOT;SPDR DoubleLine Short Duration Total Return Tactical ETF;BATS
STPZ;PIMCO 1-5 Year U.S. TIPS Index Exchange-Traded Fund;ARCX
STRW;Strawberry Fields REIT Inc.;XASE
STXS;Stereotaxis Inc. Common Stock;XASE
SUB;iShares Short-Term National Muni Bond ETF;ARCX
SUPL;ProShares Supply Chain Logistics ETF;ARCX
SUPP;TCW Transform Supply Chain ETF;BATS
SURE;AdvisorShares Insider Advantage ETF;ARCX
SURI;Simplify Propel Opportunities ETF;ARCX
SUSA;iShares MSCI USA ESG Select ETF;ARCX
SVAL;iShares US Small Cap Value Factor ETF;BATS
SVIX;-1x Short VIX Futures ETF;BATS
SVM;Silvercorp Metals Inc. Common Shares;XASE
SVOL;Simplify Volatility Premium ETF;ARCX
SVT;Servotronics Inc.;XASE
SVXY;ProShares Short VIX Short-Term Futures ETF;BATS
SWAN;Amplify BlackSwan Growth & Treasure Core ETF;ARCX
SXQG;ETC 6 Meridian Quality Growth ETF;ARCX
SXUS;Janus Henderson International Sustainable Equity ETF;ARCX
SYII;Syntax Stratified Total Market II ETF;ARCX
SYLD;Cambria Shareholder Yield ETF;BATS
SYNB;Putnam BioRevolution ETF;ARCX
SYNX;Silynxcom Ltd.;XASE
SYUS;Syntax Stratified U.S. Total Market ETF;ARCX
SZK;ProShares UltraShort Consumer Staples;ARCX
SZNE;Pacer CFRA- Stoval Equal Weight Seasonal Rotation ETF;ARCX
TACK;Fairlead Tactical Sector ETF;ARCX
TAFI;AB Tax-Aware Short Duration Municipal ETF;ARCX
TAFL;AB Tax-Aware Long Municipal ETF;ARCX
TAFM;AB Tax-Aware Intermediate Municipal ETF;ARCX
