tv-symbol;description;mic-code
FTF;Franklin Limited Duration Income Trust Common Shrs. of Beneficial Interest;XASE
FTHF;First Trust Emerging Markets Human Flourishing ETF;ARCX
FTIF;First Trust Bloomberg Inflation Sensitive Equity ETF;ARCX
FTLS;First Trust Long/Short Equity ETF;ARCX
FTRB;Federated Hermes Total Return Bond ETF;ARCX
FTSD;Franklin Short Duration U.S. Government ETF;ARCX
FUMB;First Trust Ultra Short Duration Municipal ETF;ARCX
FUNL;CornerCap Fundametrics Large-Cap ETF;BATS
FURY;Fury Gold Mines Limited;XASE
FUSI;American Century Multisector Floating Income ETF;ARCX
FUTY;Fidelity MSCI Utilities Index ETF;ARCX
FVAL;Fidelity Value Factor ETF;ARCX
FVD;First Trust Value Line Dividend Fund;ARCX
FWD;AB Disruptors ETF;ARCX
FXA;Invesco CurrencyShares Australian Dollar Trust;ARCX
FXB;Invesco CurrencyShares British Pound Sterling Trust;ARCX
FXC;Invesco CurrencyShares Canadian Dollar Trust;ARCX
FXD;First Trust Consumer Discretionary AlphaDEX Fund;ARCX
FXE;Invesco CurrencyShares Euro Currency Trust;ARCX
FXED;Sound Enhanced Fixed Income ETF;ARCX
FXF;Invesco CurrencyShares Swiss Franc Trust;ARCX
FXG;First Trust Consumer Staples AlphaDEX Fund;ARCX
FXH;First Trust Health Care AlphaDEX Fund;ARCX
FXI;iShares China Large-Cap ETF;ARCX
FXL;First Trust Technology AlphaDEX Fund;ARCX
FXN;First Trust Energy AlphaDEX Fund;ARCX
FXO;First Trust Financials AlphaDEX Fund;ARCX
FXP;ProShares UltraShort FTSE China 50 of ProShares Trust;ARCX
FXR;First Trust Industrials/Producer Durables AlphaDEX Fund;ARCX
FXU;First Trust Utilities AlphaDEX Fund;ARCX
FXY;Invesco CurrencyShares Japanese Yen Trust;ARCX
FXZ;First Trust Materials AlphaDEX Fund;ARCX
FYLD;Cambria Foreign Shareholder Yield ETF;BATS
FYLG;Global X Financials Covered Call & Growth ETF;ARCX
GAA;Cambria Global Asset Allocation ETF;BATS
GABF;Gabelli Financial Services Opportunities ETF;ARCX
GAL;SPDR SSgA Global Allocation ETF of SSgA Active Trust;ARCX
GAMR;Wedbush ETFMG Video Game Tech ETF;ARCX
GAPR;FT Vest U.S. Equity Moderate Buffer ETF - April;BATS
GAST;Gabelli Automation ETF;ARCX
GAU;Galiano Gold Inc.;XASE
GAUG;FT Vest U.S. Equity Moderate Buffer ETF - August;BATS
GBF;iShares Government/Credit Bond ETF;ARCX
GBIL;Goldman Sachs Access Treasury 0-1 Year ETF;ARCX
GBLD;Invesco MSCI Green Building ETF;ARCX
GBR;New Concept Energy Inc;XASE
GBTC;Grayscale Bitcoin Trust (BTC);ARCX
GBUY;Goldman Sachs Future Consumer Equity ETF;ARCX
GCAD;Gabelli Commercial Aerospace and Defense ETF;ARCX
GCC;WisdomTree Enhanced Commodity Strategy Fund;ARCX
GCLN;Goldman Sachs Bloomberg Clean Energy Equity ETF;BATS
GCOR;Goldman Sachs Access U.S. Aggregate Bond ETF;ARCX
GCOW;Pacer Global Cash Cows Dividend ETF;BATS
GDE;WisdomTree Efficient Gold Plus Equity Strategy Fund;BATS
GDEC;FT Vest U.S. Equity Moderate Buffer ETF - December;BATS
GDEF;Goldman Sachs Defensive Equity ETF;ARCX
GDMA;Gadsden Dynamic Multi-Asset ETF;BATS
GDMN;WisdomTree Efficient Gold Plus Gold Miners Strategy Fund;BATS
GDOC;Goldman Sachs Future Health Care Equity ETF;ARCX
GDVD;R3 Global Dividend Growth ETF;ARCX
GDX;VanEck Gold Miners ETF;ARCX
GDXD;MicroSectors Gold Miners -3x Inverse Leveraged ETN;ARCX
GDXJ;VanEck Junior Gold Miners ETF;ARCX
GDXU;MicroSectors Gold Miners 3x Leveraged ETN;ARCX
GEM;Goldman Sachs ActiveBeta Emerging Markets Equity ETF;ARCX
GEMD;Goldman Sachs Access Emerging Markets USD Bond ETF;BATS
GENC;Gencor Industries Inc.;XASE
GERM;ETFMG Treatments Testing and Advancements ETF;ARCX
GFEB;FT Vest U.S. Equity Moderate Buffer ETF - February;BATS
GFOF;Grayscale Future of Finance ETF;ARCX
GGM;GGM Macro Alignment ETF;ARCX
GGME;Invesco Next Gen Media and Gaming ETF;ARCX
GGN;GAMCO Global Gold Natural Resources & Income Trust;XASE
GGN/PB;GAMCO Global Gold Natural Resources & Income Trust 5.00% Series B;XASE
GGRW;Gabelli Growth Innovators ETF;ARCX
GGUS;Goldman Sachs MarketBeta Russell 1000 Growth Equity ETF;ARCX
GHEE;Goose Hollow Enhanced Equity ETF;BATS
GHMS;Goose Hollow Multi-Strategy Income ETF;BATS
GHTA;Goose Hollow Tactical Allocation ETF;BATS
GHYB;Goldman Sachs Access High Yield Corporate Bond ETF;ARCX
GHYG;iShares US & Intl High Yield Corp Bond ETF;BATS
GIGB;Goldman Sachs Access Investment Grade Corporate Bond ETF;ARCX
GII;SPDR S&P Global Infrastructure ETF;ARCX
GINN;Goldman Sachs Innovate Equity ETF;ARCX
GJAN;FT Vest U.S. Equity Moderate Buffer ETF - January;BATS
GJUL;FT Vest U.S. Equity Moderate Buffer ETF - July;BATS
GJUN;FT Vest U.S. Equity Moderate Buffer ETF - June;BATS
GK;AdvisorShares Gerber Kawasaki ETF;ARCX
GLD;SPDR Gold Trust SPDR Gold Shares;ARCX
GLDB;Strategy Shares Gold-Hedged Bond ETF;BATS
GLDG;GoldMining Inc.;XASE
GLDM;SPDR Gold MiniShares;ARCX
GLDX;USCF GOLD STRATEGY PLUS INCOME FUND;ARCX
GLIF;AGF Global Infrastructure ETF;ARCX
GLIN;VanEck India Growth Leaders ETF;ARCX
GLL;ProShares UltraShort Gold;ARCX
GLO;Clough Global Opportunities Fund;XASE
GLOF;iShares Global Equity Factor ETF;ARCX
GLOV;Goldman Sachs ActiveBeta World Low Vol Plus Equity ETF;BATS
GLQ;Clough Global Equity Fund;XASE
GLRY;Inspire Faithward Mid Cap Momentum ETF;ARCX
GLTR;abrdn Physical Precious Metals Basket Shares ETF;ARCX
GLU;The Gabelli Utility & Income Trust;XASE
GLU/PA;The Gabelli Global Utility & Income Trust Series A;XASE
GLU/PB;The Gabelli Global Utility & Income Trust Series B Cumulative Puttable and Callable Preferred Shares;XASE
GLV;Clough Global Dividend and Income Fund;XASE
GMAR;FT Vest U.S. Equity Moderate Buffer ETF - March;BATS
GMAY;FT Vest U.S. Equity Moderate Buffer ETF - May;BATS
GMET;VanEck Green Metals ETF;ARCX
GMF;SPDR S&P Emerging Asia Pacific ETF;ARCX
GMOM;Cambria Global Momentum ETF;BATS
GMUN;Goldman Sachs Community Municipal Bond ETF;ARCX
GNOV;FT Vest U.S. Equity Moderate Buffer ETF - November;BATS
GNR;SPDR S&P Global Natural Resources ETF;ARCX
GNS;Genius Group Limited;XASE
GOAU;US Global GO Gold and Precious Metal Miners ETF;ARCX
GOCT;FT Vest U.S. Equity Moderate Buffer ETF - October;BATS
GOEX;Global X Gold Explorers ETF (NEW);ARCX
GOOP;Kurv Yield Premium Strategy Google (GOOGL) ETF;BATS
GOOX;T-Rex 2X Long Alphabet Daily Target ETF;BATS
GOOY;YieldMax GOOGL Option Income Strategy ETF;ARCX
GORO;Gold Resource Corporation;XASE
GOVT;iShares U.S. Treasury Bond ETF;BATS
GOVZ;iShares 25+ Year Treasury STRIPS Bond ETF;BATS
GPOW;Goldman Sachs North American Pipelines & Power Equity ETF;BATS
GQI;Natixis Gateway Quality Income ETF;ARCX
GQRE;FlexShares Global Quality Real Estate Index Fund;ARCX
GREI;Goldman Sachs Future Real Estate and Infrastructure Equity ETF;ARCX
GREK;Global X MSCI Greece ETF;ARCX
GRF;Eagle Capital Growth Fund Inc.;XASE
GRFX;Graphex Group Limited;XASE
GRN;iPath Series B Carbon Exchange-Traded Notes;ARCX
GRNB;VanEck Green Bond ETF;ARCX
GROY;Gold Royalty Corp.;XASE
GROY/W;Gold Royalty Corp. Warrants each warrant exercisable for one common share at an exercise price of $7.50;XASE
GRPM;Invesco S&P MidCap 400 GARP ETF;ARCX
GSAT;Globalstar Inc.;XASE
GSC;Goldman Sachs Small Cap Core Equity ETF;ARCX
GSEE;Goldman Sachs MarketBeta Emerging Markets Equity ETF;BATS
GSEP;FT Vest U.S. Equity Moderate Buffer ETF - September;BATS
GSEU;Goldman Sachs ActiveBeta Europe Equity ETF;ARCX
GSEW;Goldman Sachs Equal Weight U.S. Large Cap Equity ETF;BATS
GSFP;Goldman Sachs Future Planet Equity ETF;ARCX
GSG;iShares S&P  GSCI Commodity-Indexed Trust;ARCX
GSID;Goldman Sachs MarketBeta International Equity ETF;BATS
GSIE;Goldman Sachs ActiveBeta International Equity ETF;ARCX
GSIG;Goldman Sachs Access Investment Grade Corporate 1-5 Year Bond ETF;ARCX
GSJY;Goldman Sachs ActiveBeta Japan Equity ETF;ARCX
GSLC;Goldman Sachs ActiveBeta U.S. Large Cap Equity ETF;ARCX
GSPY;Gotham Enhanced 500 ETF;ARCX
GSSC;GS ActiveBeta U.S. Small Cap Equity ETF;ARCX
GSST;Goldman Sachs Access Ultra Short Bond ETF;BATS
GSUS;Goldman Sachs MarketBeta U.S. Equity ETF;BATS
GSY;Invesco Ultra Short Duration ETF;ARCX
GTE;Gran Tierra Energy Inc.;XASE
GTEK;Goldman Sachs Future Tech Leaders Equity ETF;ARCX
GTIP;Goldman Sachs Access Inflation Protected USD Bond ETF;BATS
GTO;Invesco Total Return Bond ETF;ARCX
GUNR;FlexShares Global Upstream Natural Resources Index Fund;ARCX
GURU;Global X Guru Index ETF;ARCX
GUSA;Goldman Sachs MarketBeta U.S. 1000 Equity ETF;ARCX
GUSH;Direxion Daily S&P Oil & Gas Exp. & Prod. Bull 2X Shares;ARCX
GVAL;Cambria Global Value ETF;BATS
GVI;iShares Intermediate Government/Credit Bond ETF;BATS
GVIP;Goldman Sachs Hedge Industry VIP ETF;ARCX
GVLU;Gotham 1000 Value ETF;ARCX
GVUS;Goldman Sachs MarketBeta Russell 1000 Value Equity ETF;ARCX
GWX;SPDR S&P International Small Cap ETF;ARCX
GXC;SPDR S&P China ETF;ARCX
GXG;Global X MSCI Colombia ETF;ARCX
GXUS;Goldman Sachs MarketBeta Total International Equity ETF;ARCX
GYLD;Arrow Dow Jones Global Yield ETF;ARCX
HACK;ETFMG Prime Cyber Security ETF;ARCX
HAIL;SPDR S&P Kensho Smart Mobility ETF;ARCX
HAP;VanEck Natural Resources ETF;ARCX
HAPI;Harbor Human Capital Factor US Large Cap ETF;ARCX
HAPS;Harbor Human Capital Factor US Small Cap ETF;ARCX
HAPY;Harbor Human Capital Factor Unconstrained ETF;ARCX
HARD;Simplify Commodities Strategy No K-1 ETF;ARCX
HART;IQ Healthy Hearts ETF;ARCX
HAUS;Residential REIT ETF;BATS
HAUZ;Xtrackers International Real Estate ETF;ARCX
HAWX;iShares Currency Hedged MSCI ACWI ex U.S. ETF;ARCX
HCMT;Direxion HCM Tactical Enhanced US ETF;ARCX
HCOM;Hartford Schroders Commodity Strategy ETF;ARCX
HCRB;Hartford Core Bond ETF;BATS
HDAW;Xtrackers MSCI All World ex US High Dividend Yield Equity ETF;ARCX
HDEF;Xtrackers MSCI EAFE High Dividend Yield Equity ETF;ARCX
HDG;ProShares Hedge Replication ETF;ARCX
HDGE;AdvisorShares Ranger Equity Bear ETF;ARCX
HDLB;ETRACS Monthly Pay 2xLeveraged US High Dividend Low Volatility ETN Series B due October 21 2049;ARCX
HDMV;First Trust Horizon Managed Volatility Developed International ETF;ARCX
HDRO;Defiance Next Gen H2 ETF;ARCX
HDUS;Hartford Disciplined US Equity ETF;ARCX
HDV;iShares Core High Dividend ETF;ARCX
HEAT;Touchstone Climate Transition ETF;BATS
HEDJ;WisdomTree Europe Hedged Equity Fund;ARCX
HEEM;iShares Currency Hedged MSCI Emerging Markets;BATS
HEFA;iShares Currency Hedged MSCI EAFE ETF;BATS
HEGD;Swan Hedged Equity US Large Cap ETF;BATS
HELO;JPMorgan Hedged Equity Laddered Overlay ETF;ARCX
HELX;Franklin Genomic Advancements ETF;BATS
HEQT;Simplify Hedged Equity ETF;ARCX
HEWJ;iShares Currency Hedged MSCI Japan ETF;ARCX
HEZU;iShares Currency Hedged MSCI Eurozone ETF of ISHARES TRUST;ARCX
HF;DGA Absolute Return ETF;ARCX
HFGO;Hartford Large Cap Growth ETF;BATS
HFND;Unlimited HFND Multi-Strategy Return Tracker ETF;ARCX
HFXI;IQ FTSE International Equity Currency Neutral ETF;ARCX
HIBL;Direxion Daily S&P 500 High Beta Bull 3X Shares;ARCX
HIBS;Direxion Daily S&P 500 High Beta Bear 3X Shares;ARCX
HIDV;AB US High Dividend ETF;ARCX
HIGH;Simplify Enhanced Income ETF;ARCX
HIPS;GraniteShares HIPS US High Income ETF;ARCX
HIYS;Invesco High Yield Select ETF;BATS
HJAN;Innovator Premium Income 9 Buffer ETF - January;BATS
HJEN;Direxion Hydrogen ETF;ARCX
HKND;Humankind US Stock ETF;ARCX
HLGE;Hartford Longevity Economy ETF;ARCX
HMOP;Hartford Municipal Opportunities ETF;ARCX
HNRA;HNR Acquisition Corp;XASE
HNRA/W;HNR Acquisition Corp Warrants each whole warrant exercisable for three quarters of one share of Class A Common Stock at an exercise price of $11.50 per whole share;XASE
HNW;Pioneer Diversified High Income Fund Inc.;XASE
HOCT;Innovator Premium Income 9 Buffer ETF - October;BATS
HODL;VanEck Bitcoin Trust;BATS
HOMZ;Hoya Capital Housing ETF;ARCX
HSCZ;iShares Currency Hedged MSCI EAFE Small-Cap ETF;ARCX
HSMV;First Trust Horizon Managed Volatility Small/Mid ETF;ARCX
HSRT;Hartford Short Duration ETF;BATS
HSUN;Hartford Sustainable Income ETF;BATS
HTAB;Hartford Schroders Tax-Aware Bond ETF;ARCX
HTEC;ROBO Global Healthcare Technology and Innovation ETF;ARCX
HTRB;Hartford Total Return Bond ETF;ARCX
HTUS;Hull Tactical US ETF;ARCX
HUSA;Houston American Energy Corp;XASE
HUSV;First Trust Horizon Managed Volatility Domestic ETF;ARCX
HWM/P;Howmet Aerospace Inc. $3.75 Cumulative Preferred Stock;XASE
HYBB;iShares BB Rated Corporate Bond ETF;ARCX
HYBL;SPDR Blackstone High Income ETF;BATS
HYD;VanEck High Yield Muni ETF;BATS
HYDB;iShares High Yield Bond Factor ETF;BATS
HYDW;Xtrackers Low Beta High Yield Bond ETF;ARCX
HYEM;VanEck Emerging Markets High Yield Bond ETF;ARCX
HYFI;AB High Yield ETF;ARCX
HYG;iShares iBoxx $ High Yield Corporate Bond ETF;ARCX
HYGH;iShares Interest Rate Hedged High Yield Bond ETF;ARCX
HYGI;iShares Inflation Hedged High Yield Bond ETF;ARCX
HYGV;FlexShares High Yield Value-Scored Bond Index Fund;ARCX
HYGW;iShares High Yield Corporate Bond BuyWrite Strategy ETF;BATS
HYHG;ProShares High Yield-Interest Rate Hedged ETF;BATS
HYIN;WisdomTree Alternative Income Fund;BATS
HYKE;Vest 2 Year Interest Rate Hedge ETF;BATS
HYLB;Xtrackers USD High Yield Corporate Bond ETF;ARCX
HYLG;Global X Health Care Covered Call & Growth ETF;ARCX
HYMB;SPDR Nuveen Bloomberg High Yield Municipal Bond ETF;ARCX
HYMU;BlackRock High Yield Muni Income Bond ETF;BATS
HYRM;Xtrackers Risk Managed USD High Yield Strategy ETF;ARCX
HYS;PIMCO 0-5 Year High Yield Corporate Bond Index Exchange-Traded Fund;ARCX
HYSA;BondBloxx USD High Yield Bond Sector Rotation ETF;ARCX
HYTR;CP High Yield Trend ETF;ARCX
HYUP;Xtrackers High Beta High Yield Bond ETF;ARCX
HYXU;iShares Global ex USD High Yield Corporate Bond ETF;BATS
IAF;abrdn Australia Equity Fund Inc.;XASE
IAGG;iShares Core International Aggregate Bond Fund;BATS
IAI;iShares U.S. Broker-Dealers & Securities Exchanges ETF;ARCX
IAK;iShares U.S. Insurance ETF;ARCX
IAPR;Innovator International Developed Power Buffer ETF - April;ARCX
IAT;iShares U.S. Regional Banks ETF;ARCX
IAU;iShares Gold Trust;ARCX
IAUF;iShares Gold Strategy ETF;BATS
IAUM;iShares Gold Trust Micro;ARCX
IAUX;i-80 Gold Corp.;XASE
IBD;Inspire Corporate Bond ETF;ARCX
IBDP;iShares iBonds Dec 2024 Term Corporate ETF;ARCX
IBDQ;iShares iBonds Dec 2025 Term Corporate ETF;ARCX
IBDR;iShares iBonds Dec 2026 Term Corporate ETF;ARCX
IBDS;iShares iBonds Dec 2027 Term Corporate ETF;ARCX
IBDT;iShares iBonds Dec 2028 Term Corporate ETF;ARCX
IBDU;iShares iBonds Dec 2029 Term Corporate ETF;ARCX
IBDV;iShares iBonds Dec 2030 Term Corporate ETF;ARCX
IBDW;iShares iBonds Dec 2031 Term Corporate ETF;ARCX
IBDX;iShares iBonds Dec 2032 Term Corporate ETF;ARCX
IBDY;iShares iBonds Dec 2033 Term Corporate ETF;ARCX
IBHD;iShares iBonds 2024 Term High Yield and Income ETF;BATS
IBHE;iShares iBonds 2025 Term High Yield and Income ETF;BATS
IBHF;iShares iBonds 2026 Term High Yield and Income ETF;BATS
IBHG;iShares iBonds 2027 Term High Yield and Income ETF;BATS
IBHH;iShares iBonds 2028 Term High Yield and Income ETF;BATS
IBHI;iShares iBonds 2029 Term High Yield and Income ETF;BATS
IBHJ;iShares iBonds 2030 Term High Yield and Income ETF;BATS
IBIA;iShares iBonds Oct 2024 Term TIPS ETF;ARCX
IBIB;iShares iBonds Oct 2025 Term TIPS ETF;ARCX
IBIC;iShares iBonds Oct 2026 Term TIPS ETF;ARCX
IBID;iShares iBonds Oct 2027 Term TIPS ETF;ARCX
IBIE;iShares iBonds Oct 2028 Term TIPS ETF;ARCX
IBIF;iShares iBonds Oct 2029 Term TIPS ETF;ARCX
IBIG;iShares iBonds Oct 2030 Term TIPS ETF;ARCX
IBIH;iShares iBonds Oct 2031 Term TIPS ETF;ARCX
IBII;iShares iBonds Oct 2032 Term TIPS ETF;ARCX
IBIJ;iShares iBonds Oct 2033 Term TIPS ETF;ARCX
IBIO;iBio Inc.;XASE
IBLC;iShares Blockchain and Tech ETF;ARCX
IBMM;iShares iBonds Dec 2024 Term Muni Bond ETF;BATS
IBMN;iShares iBonds Dec 2025 Term Muni Bond ETF;BATS
IBMO;iShares iBonds Dec 2026 Term Muni Bond ETF;BATS
IBMP;iShares iBonds Dec 2027 Term Muni Bond ETF;BATS
IBMQ;iShares iBonds Dec 2028 Term Muni Bond ETF;BATS
IBMR;iShares iBonds Dec 2029 Term Muni Bond ETF;BATS
IBND;SPDR Bloomberg International Corporate Bond ETF;ARCX
IBO;NYSE AMEX Listed Test Stock For CTS CQS;XASE
IBRN;iShares Neuroscience and Healthcare ETF;ARCX
IBUY;Amplify Online Retail ETF;ARCX
ICAP;InfraCap Equity Income Fund ETF;ARCX
ICF;iShares Cohen & Steers REIT ETF;BATS
ICLO;Invesco AAA CLO Floating Rate Note ETF;BATS
ICOW;Pacer Developed Markets International Cash Cows 100 ETF;BATS
ICSH;BlackRock Ultra Short-Term Bond ETF;BATS
ICVT;iShares Convertible Bond ETF;BATS
IDAT;iShares Future Cloud 5G and Tech ETF;ARCX
IDEC;Innovator International Developed Power Buffer ETF - December;ARCX
IDEV;iShares Core MSCI International Developed Markets ETF;ARCX
IDGT;iShares U.S. Digital Infrastructure and Real Estate ETF;ARCX
IDHQ;Invesco S&P International Developed Quality ETF;ARCX
IDLV;Invesco S&P International Developed Low Volatility ETF;ARCX
IDMO;Invesco S&P International Developed Momentum ETF;ARCX
IDNA;iShares Genomics Immunology and Healthcare ETF;ARCX
IDOG;ALPS International Sector Dividend Dogs ETF;ARCX
IDR;Idaho Strategic Resources Inc.;XASE
IDRV;iShares Self-Driving EV and Tech ETF;ARCX
IDU;iShares U.S. Utilities ETF;ARCX
IDUB;Aptus International Enhanced Yield ETF;BATS
IDV;iShares International Select Dividend ETF;BATS
IDVO;Amplify International Enhanced Dividend Income ETF;ARCX
IDX;VanEck Indonesia Index ETF;ARCX
IE;Ivanhoe Electric Inc.;XASE
IEDI;iShares U.S. Consumer Focused ETF;BATS
IEFA;iShares Core MSCI EAFE ETF;BATS
IEMG;iShares Core MSCI Emerging Markets ETF;ARCX
IEO;iShares U.S. Oil & Gas Exploration & Production ETF;BATS
IETC;iShares U.S. Tech Independence Focused ETF;BATS
IEUR;iShares Core MSCI Europe ETF;ARCX
IEV;iShares Europe ETF;ARCX
IEZ;iShares U.S. Oil Equipment & Services ETF;ARCX
IFED;ETRACS IFED Invest with the Fed TR Index ETN;ARCX
IFRA;iShares U.S. Infrastructure ETF;BATS
IG;Principal Investment Grade Corporate Active ETF;ARCX
IGBH;iShares Interest Rate Hedged Long-Term Corporate Bond ETF;ARCX
IGC;IGC Pharma Inc.;XASE
IGE;iShares North American Natural Resources ETF;BATS
IGEB;iShares Investment Grade Bond Factor ETF;BATS
IGHG;ProShares Investment Grade-Interest Rate Hedged;BATS
IGLB;iShares 10+ Year Investment Grade Corporate Bond ETF;ARCX
IGLD;FT Vest Gold Strategy Target Income ETF;BATS
IGM;iShares Expanded Tech Sector ETF;ARCX
IGPT;Invesco AI and Next Gen Software ETF;ARCX
IGRO;iShares International Dividend Growth ETF;BATS
IGTR;Innovator Gradient Tactical Rotation Strategy ETF;ARCX
IGV;iShares Expanded Tech-Software Sector ETF;BATS
IGZ;NYSE Arca Listed Test Stock For CTS CQS;ARCX
IHAK;iShares Cybersecurity and Tech ETF;ARCX
IHDG;WisdomTree International Hedged Quality Dividend Growth Fund;ARCX
IHE;iShares U.S. Pharmaceuticals ETF;ARCX
IHF;iShares U.S. Healthcare Providers ETF;ARCX
IHI;iShares U.S. Medical Devices ETF;ARCX
IHT;InnSuites Hospitality Trust;XASE
IHY;VanEck International High Yield Bond ETF;ARCX
IIGD;Invesco Investment Grade Defensive ETF;ARCX
IJAN;Innovator International Developed Power Buffer ETF - January;ARCX
IJH;iShares Core S&P Mid-Cap ETF;ARCX
IJJ;iShares S&P Mid-Cap 400 Value ETF;ARCX
IJK;iShares S&P Mid-Cap 400 Growth ETF;ARCX
IJR;iShares Core S&P Small-Cap ETF;ARCX
IJS;iShares S&P Small-Cap 600 Value ETF;ARCX
IJUL;Innovator International Developed Power Buffer ETF - July;ARCX
ILCB;iShares Morningstar U.S. Equity ETF;ARCX
ILCG;iShares Morningstar Growth ETF;ARCX
ILCV;iShares Morningstar Value ETF;ARCX
ILDR;First Trust Innovation Leaders ETF;ARCX
ILF;iShares Latin America 40 ETF;ARCX
ILTB;iShares Core 10+ Year USD Bond ETFof iShares Trust;ARCX
IMCB;iShares Morningstar Mid-Cap ETF;ARCX
IMCG;iShares Morningstar Mid-Cap Growth ETF;ARCX
IMFL;Invesco International Developed Dynamic Multifactor ETF;BATS
IMO;Imperial Oil Limited;XASE
IMSI;Invesco Municipal Strategic Income ETF;BATS
IMTB;iShares Core 5-10 Year USD Bond ETF;ARCX
IMTM;iShares MSCI Intl Momentum Factor ETF;ARCX
INAV;Mohr Industry Nav ETF;BATS
INC;VanEck Dynamic High Income ETF;ARCX
INCM;Franklin Income Focus ETF;ARCX
INCO;Columbia India Consumer ETF;ARCX
INDA;iShares MSCI India ETF;BATS
INDE;Matthews India Active ETF;ARCX
INDF;Nifty India Financials ETF;ARCX
INDL;Direxion Daily MSCI India Bull 2X Shares;ARCX
INDO;Indonesia Energy Corporation Limited;XASE
INDS;Pacer Industrial Real Estate ETF;ARCX
INFL;Horizon Kinetics Inflation Beneficiaries ETF;ARCX
INFU;InfuSystem Holdings Inc.;XASE
INKM;SPDR SSgA Income Allocation ETF of SSgA Active Trust;ARCX
INLX;Intellinetics Inc.;XASE
INMU;BlackRock Intermediate Muni Income Bond ETF;ARCX
INNO;Harbor Disruptive Innovation ETF;ARCX
INOV;Innovator International Developed Power Buffer ETF - November;ARCX
INQQ;India Internet & Ecommerce ETF;ARCX
INTF;iShares International Equity Factor ETF;ARCX
INTL;Main International ETF;BATS
INTT;inTEST Corporation;XASE
INUV;Inuvo Inc.;XASE
IOCT;Innovator International Developed Power Buffer ETF-October;ARCX
ION;ProShares S&P Global Core Battery Metals ETF;ARCX
IOO;iShares Global 100 ETF;ARCX
IOR;Income Opportunity Realty Investors Inc.;XASE
IPAC;iShares Core MSCI Pacific ETF;ARCX
IPAY;ETFMG Prime Mobile Payments ETF;ARCX
IPB;Merrill Lynch 6.0518% Index Plus Trust Certificates Series 2003-1;XASE
IPDP;Dividend Performers ETF;BATS
IPO;Renaissance IPO ETF;ARCX
IPOS;Renaissance International IPO ETF;ARCX
IPPP;Preferred-Plus ETF;BATS
IQDE;FlexShares International Quality Dividend Defensive Index Fund;ARCX
IQDF;FlexShares International Quality Dividend Index Fund;ARCX
IQDG;WisdomTree International Quality Dividend Growth Fund;BATS
IQDY;FlexShares International Quality Dividend Dynamic Index Fund;ARCX
IQHI;IQ MacKay ESG High Income ETF;ARCX
IQIN;IQ 500 International ETF;ARCX
IQLT;iShares MSCI Intl Quality Factor ETF;ARCX
IQM;Franklin Intelligent Machines ETF;BATS
IQRA;IQ CBRE Real Assets ETF;ARCX
IQSI;IQ Candriam International Equity ETF;ARCX
IQSM;IQ Candriam U.S. Mid Cap Equity ETF;ARCX
IQSU;IQ Candriam U.S. Large Cap Equity ETF;ARCX
IRBA;iMGP RBA Responsible Global Allocation ETF;ARCX
IRBO;iShares Robotics and Artificial Intelligence Multisector ETF;ARCX
IRTR;iShares LifePath Retirement ETF;ARCX
IRVH;Global X Interest Rate Volatility & Inflation Hedge ETF;ARCX
ISCB;iShares Morningstar Small-Cap ETF;ARCX
ISCF;iShares International Small Cap Equity Factor ETF;ARCX
ISCG;iShares Morningstar Small-Cap Growth ETF;ARCX
ISCV;iShares Morningstar Small-Cap Value ETF;ARCX
ISDB;Invesco Short Duration Bond ETF;BATS
ISDR;Issuer Direct Corporation;XASE
ISEP;Innovator International Developed Power Buffer ETF - September;ARCX
ISMD;Inspire Small/Mid Cap ETF;ARCX
ISPY;ProShares S&P 500 High Income ETF;BATS
ISRA;VanEck Israel ETF;ARCX
ISVL;iShares International Developed Small Cap Value Factor ETF;BATS
ISWN;Amplify BlackSwan ISWN ETF;ARCX
ISZE;iShares MSCI Intl Size Factor ETF;ARCX
ITA;iShares U.S. Aerospace & Defense ETF;BATS
ITAN;Sparkline Intangible Value ETF;ARCX
ITB;iShares U.S. Home Construction ETF;BATS
ITDA;iShares LifePath Target Date 2025 ETF;ARCX
ITDB;iShares LifePath Target Date 2030 ETF;ARCX
ITDC;iShares LifePath Target Date 2035 ETF;ARCX
ITDD;iShares LifePath Target Date 2040 ETF;ARCX
ITDE;iShares LifePath Target Date 2045 ETF;ARCX
ITDF;iShares LifePath Target Date 2050 ETF;ARCX
ITDG;iShares LifePath Target Date 2055 ETF;ARCX
ITDH;iShares LifePath Target Date 2060 ETF;ARCX
ITDI;iShares LifePath Target Date 2065 ETF;ARCX
ITEQ;BlueStar Israel Technology ETF;ARCX
ITM;VanEck Intermediate Muni ETF;BATS
ITOT;iShares Core S&P Total U.S. Stock Market ETF;ARCX
ITP;IT Tech Packaging Inc.;XASE
ITRG;Integra Resources Corp.;XASE
IVE;iShares S&P 500 Value ETF;ARCX
IVES;Wedbush ETFMG Global Cloud Technology ETF;ARCX
IVLU;iShares MSCI Intl Value Factor ETF;ARCX
IVOG;Vanguard S&P Mid-Cap 400 Growth ETF;ARCX
IVOL;Quadratic Interest Rate Volatility and Inflation Hedge ETF;ARCX
IVOO;Vanguard S&P Mid-Cap 400 ETF;ARCX
IVOV;Vanguard S&P Mid-Cap 400 Value ETF;ARCX
IVRA;Invesco Real Assets ESG ETF;BATS
IVRS;iShares Future Metaverse Tech and Communications ETF;ARCX
IVV;iShares Core S&P 500 ETF;ARCX
IVVB;iShares Large Cap Deep Buffer ETF;BATS
IVVM;iShares Large Cap Moderate Buffer ETF;BATS
IVW;iShares S&P 500 Growth ETF;ARCX
IWB;iShares Russell 1000 ETF;ARCX
IWC;iShares Micro-Cap ETF;ARCX
IWD;iShares Russell 1000 Value ETF;ARCX
IWDL;ETRACS 2x Leveraged US Value Factor TR ETN;ARCX
IWF;iShares Russell 1000 Growth ETF;ARCX
IWFG;IQ Winslow Focused Large Cap Growth ETF;ARCX
IWFH;iShares Virtual Work and Life Multisector ETF;ARCX
IWFL;ETRACS 2x Leveraged US Growth Factor TR ETN;ARCX
IWIN;Amplify Inflation Fighter ETF;ARCX
IWL;iShares Russell Top 200 ETF;ARCX
IWLG;IQ Winslow Large Cap Growth ETF;ARCX
IWM;iShares Russell 2000 ETF;ARCX
IWML;ETRACS 2x Leveraged US Size Factor TR ETN;ARCX
IWMY;Defiance R2000 Enhanced Options Income ETF;ARCX
IWN;iShares Russell 2000 Value ETF;ARCX
IWO;iShares Russell 2000 Growth ETF;ARCX
IWP;iShares Russell Mid-Cap Growth ETF;ARCX
IWR;iShares Russell Mid-Cap ETF;ARCX
IWS;iShares Russell Mid-Cap Value ETF;ARCX
IWV;iShares Russell 3000 ETF;ARCX
IWX;iShares Russell Top 200 Value ETF;ARCX
IWY;iShares Russell Top 200 Growth ETF;ARCX
IXC;iShares Global Energy ETF;ARCX
IXG;iShares Global Financials ETF;ARCX
IXJ;iShares Global Healthcare ETF;ARCX
IXN;iShares Global Tech ETF;ARCX
IXP;iShares Global Comm Services ETF;ARCX
IYC;iShares U.S. Consumer Discretionary ETF;ARCX
IYE;iShares U.S. Energy ETF;ARCX
IYF;iShares U.S. Financials ETF;ARCX
IYG;iShares U.S. Financial Services ETF;ARCX
IYH;iShares U.S. Healthcare ETF;ARCX
IYJ;iShares U.S. Industrials ETF;BATS
IYK;iShares U.S. Consumer Staples ETF;ARCX
IYLD;iShares Morningstar Multi-Asset Income ETF;BATS
IYM;iShares U.S. Basic Materials ETF;ARCX
IYR;iShares U.S. Real Estate ETF;ARCX
IYT;iShares U.S. Transportation ETF;BATS
IYW;iShares U.S. Technology ETF;ARCX
IYY;iShares Dow Jones U.S. ETF;ARCX
IYZ;iShares U.S. Telecommunications ETF;BATS
IZRL;ARK Israel Innovative Technology ETF;BATS
JAAA;Janus Henderson AAA CLO ETF;ARCX
JAND;Innovator Premium Income 10 Barrier ETF - January;BATS
JANH;Innovator Premium Income 20 Barrier ETF - January;BATS
JANJ;Innovator Premium Income 30 Barrier ETF - January;BATS
JANP;PGIM US Large-Cap Buffer 12 ETF - January;BATS
JANQ;Innovator Premium Income 40 Barrier ETF - January;BATS
JANT;AllianzIM U.S. Large Cap Buffer10 Jan ETF;ARCX
JANW;AllianzIM U.S. Large Cap Buffer20 Jan ETF;ARCX
JANZ;TrueShares Structured Outcome (January) ETF;BATS
JAVA;JPMorgan Active Value ETF;ARCX
JBBB;Janus Henderson B-BBB CLO ETF;BATS
